,Name,Star,Location,Date,Title,Review
593,Y. Robinson,4.0,the United States ,"March 22, 2020",Nice...Fits Big,The shirts are nice. Bought for my 6 year old. The shirts fit pretty big on him. He’s around 54 pounds. Could have fit an x-small.
594,olufunke,4.0,the United States ,"December 15, 2020",Gud,Just okay
595,Benna,4.0,the United States ,"October 12, 2020",ALL COTTON BUT.........,NOT THE SOFTEST COTTON.
596,Christabel Ewane,5.0,the United States ,"November 17, 2022",They look good on my son,I luv them. Very quality
597,nichole,5.0,the United States ,"November 7, 2022",These were perfect.,So soft. I will be buying again
598,Mel,5.0,the United States ,"October 1, 2022",Buy the Small if your child is lean and taller for his age.,I purchased the XS for our 4.5 yr old grandson. They were too short after the first washing. Purchased the Small(6-8) and they looked much too large before washing. After the coldwater wash they are perfect.Room to grow and long enough to cover bellybutton. Good luck.
599,Teresa M. Shobe,5.0,the United States ,"September 20, 2022",Perfect and SOFT!,"We bought these for a school project, but were super pleased with how soft and comfortable they are.  We were glad we got extra so that one could go to school for the project and the rest could go into the regular wardrobe rotation."
600,Lorena halley,5.0,the United States ,"October 4, 2022",Excelente,Excelente calidad
601,Amazon Customer,5.0,the United States ,"September 18, 2022",Size is good,Grandson is 5 and the size small is 6-7 works good
602,Amazon Customer,5.0,the United States ,"August 3, 2022",They exceeded expectations,I wasn't expecting much based on some of the reviews but these shirts exceeded my expectations. It fits true to size and the fabric is good thickness.
603,Judee,5.0,the United States ,"August 17, 2022",Great T Shirt,"This was for my grandson, he loved the softness and the fit"
604,Kareena,5.0,the United States ,"August 22, 2022",Perfect fit,Perfect fit for my Chunky 4 years
605,cenith williams,5.0,the United States ,"August 25, 2022",Soft,Soft
606,Brandee Lowman,1.0,the United States ,"October 16, 2022",SHRANK!,"I bought Hanes M/M/M before and these went in one size after washing and came out super small. They are not cheap, so it was disappointing to not have the packaging to return them and not have the product I needed.  I wash in cold all the time, dry the same all the time, and don't think I will trust Hanes again."
607,Amazon Customer,1.0,the United States ,"July 16, 2022",WORST EVER !! A shame for Amazon,"Purchased it on line as I did many times before. After one use and after washing it for the first time, it shrank to a size that my 8 year old son can't even wear.Save yourself couple of bucks and don't buy it. What a shame. Can't believe Amazon are still approving it."
608,Karen Alcequiez,1.0,the United States ,"August 27, 2022",Se lavó y se puso miniatura! Increíble! No lo recomiendo,"Muy pequeño! Cuando llego mi esposo lo lavó y se puso miniatura casi, se lo tuvo que regalar a su sobrinito de 6 años"
609,Yolonda,1.0,the United States ,"September 29, 2022",Fit,My Granson to small needs to return
610,Nordia Dehaney,1.0,the United States ,"August 13, 2022",Way too small not stretchy,Disappointed in this purchase… had to give them away
611,Alena,1.0,the United States ,"September 22, 2020",Something is wrong with Hanes sizing,"I ordered my very very small 11 year old the Medium - size 10/12, thinking they'd be big on him. He said they were too small. I handed them over to his average sized 7 year old brother and they fit him well - they were snug even. So I ordered this larger size and they came and are HUGE (probably size appropriate). Watch out with the sizing on these."
612,Del Davidow,1.0,the United States ,"July 14, 2022",Runs extra small,Got a large. Wore like a small.
613,Kim Turner,1.0,the United States ,"October 4, 2019","Amazon/Hsnes, Correct your SIZE charts!!","Your size chart States a size Large in these are as follows:""L, size 12-14, 58-64 lbs, 28.5-30.5 height, inches, chest= 26.5-28, inches.""Because my son is a size 12, I ordered these. The package I received IS a LARGE, but these are a size 14-16!! It would be nice if your size charts were accurate.Also sending back too large T-shirts that had the SAME, incorrect size chart."
614,La,1.0,the United States ,"October 31, 2020",Threads loosen and hang after one wear.,"First of all, these fit my 5 y/o son snugly- they don't have a loose fit like I expected them to have, which, in my opinion, defeats the purpose of ""breathable"" material. Secondly, every time my son wears a pair of these, strings/thread start loosening up and hanging from them- after ONE wear!! These underwear are WHACK!!"
615,ALEX,1.0,the United States ,"April 7, 2020",Knock-offs,"I bought this same exact pack, same size from Target a month before buying these. I went ahead and bought an extra pack just to have, but they are way smaller than what their size says. I have pictures to show the difference, but for some reason am unable to post them. Literally their large is like a small. Total rip off!"
616,Steven G.,2.0,the United States ,"March 20, 2021",Did not receive the colors pictured,"The photo shows an assortment of 2 blue, 2 black and 2 gray.  I received 3 blues, 1 black 1 gray and 1 neon green!  Not thrilled as my son will not wear the neon green pair."
617,J,2.0,the United States ,"July 20, 2019",Unfortunately not what I expected from Hanes,I don't recommend these at all. I've used Hanes before and like that brand.The problem with these in particular is that the band around the thighs is rigid instead of elastic or stretchy. So when you sit you will feel tightness around your thighs which is extremely uncomfortable.I ended up stretching them with my hands until I heard a rip. At that point they became usable.It's a shame because Hanes was my go-to standard for Boxer Briefs until this happened.
618,EEJA,2.0,the United States ,"May 16, 2020",Too tight and not soft enough,"The fabric is not elastic enough and soft enough, especially the waist, which is too tight to make it uncomfortable, so compared to this price, it is not satisfactory. Actually it is really strange, the inner thread of pants is tough than the outside thread, that's why it looks better but Wearing it feels not good."
619,D. Jackson,2.0,the United States ,"July 23, 2020",Horrible Material- which is not typical,"For some reason these were not as soft and comfortable as the Hanes underwear I have purchased in the past for my son. I purchased the same style and size, but these felt like sandpaper. My son refused to wear them. Now I’ve wasted money on useless underwear."
620,Rush,2.0,the United States ,"July 12, 2021",Alright,Fit very small so size up. Only have had a couple months and already have signs of wear. Holes etc
621,Meni Zalzman,2.0,the United States ,"March 23, 2021",Not the most comfort boxer,"Bought it for my child and he complained that the boxers are not the most comfortable boxer he ware, but overall the boxer fits well."
622,Amazon Customer,2.0,the United States ,"September 3, 2021",Did not fit to normal small size,"I purchased a ""small"" that was not fit to size as it was too small."
623,Scarlet Witch,2.0,the United States ,"December 27, 2019",2 sizes too small,When I took them out of the pack they looked decently sized but after I washed them one time they literally shrunk.. I even went a size up for my son and these are way too small. I should have gone up two sizes. I got a medium (fits like small) for my son who weighs 68 pounds at nearly 5 years old.
624,Nancy Evans,2.0,the United States ,"July 1, 2020",Watch sizes,"I ordered Medium boys and the packaging said medium.  However, the label on the underwear said XL.  Good thing he is growing so I will keep them for the future.  He will probably be in high school before he can wear them."
625,Tararaa,2.0,the United States ,"December 31, 2019",Stinks,Sizing was a little off but the main issue was the smell. It took several washes with heavily scented laundry products to get rid of a strong odor that was emanating from these undergarments. Tag on packaging said “made in India”. Found same product in a store for slightly more money and was more satisfied.
626,Amazon Customer,3.0,the United States ,"June 24, 2022","Would be nice, but they get stretched out soon after putting on","The fabric feels really soft and nice at first, but soon after putting them on, they get stretched out and baggy. They run a little bigger than other Hanes stretch styles, and then end up huge with wear. Wedgie central. Won’t buy again."
627,Angie,3.0,the United States ,"June 9, 2022",They run small,Make sure you order a size BIGGER 😐 they are ONLY 5% spandex.. they don't stretch at all
628,Sheryl Sharp,3.0,the United States ,"March 25, 2022",Scratchy,I have one son that wears these without complaint and another son that won’t wear them a single day. He says they are scratchy. We have had lots of Hanes underwear over the years and these are not the favorite.
629,Suzy Q,3.0,the United States ,"May 15, 2022",Too small,Too small but couldn't return because they were shipped to the summer camp my son was at.
630,Sleek,3.0,the United States ,"May 10, 2022",Not for adult,The briefs run very small. I wear medium size. These briefs are for kids.
631,Kevin Holguín Reynoso,3.0,the United States ,"May 10, 2022",Too small,Medium is like small
632,Ryan,3.0,the United States ,"February 10, 2022",Carefull with sizes,My bouy is about 55 lbs and on the skinny side these are way to big if your kid is under 60 lbs I'd say to big
633,Lisbel,3.0,the United States ,"December 21, 2020",WAY TOO SMALL,"my husband wears a medium in all his underwear and it’s not our first time trying hanes they all work great. SIS WHEN I TELL YOU THIS MAN CAME OUT THE BATHROOM AND THE UNDERWEAR WOULDNT GO PAST HIS THIGHS I DIED AND CAME BACK. They looked like they fit our 6 year old son, it didn’t so what a shame smh! Anywho if you plan on buying this pantiessssss for jur mannnn i recommend sizing up bc it says breathable buy then your poor mans penis is going to be crammed like a genie in a bottle..."
634,Zody,3.0,the United States ,"October 15, 2021",Small was a good fit,"Got the small for my son who is 8, 9 in Dec and he is on the slim side 4'8.5 tall"
635,HEATHER M WOCHNICK,3.0,the United States ,"July 23, 2021",Not as soft as needed,Son says they are scratchy and not soft.
636,Moises Palma Plua,4.0,the United States ,"September 2, 2022",Exelente producto,De acuerdo a la talla solicitada.
637,Ellen,4.0,the United States ,"September 7, 2022",Great comfort!,Great value
638,Amazon Customer,4.0,the United States ,"August 4, 2022",Run a little small,Material has comfort but if a large is needed may need to order a x-large.  The items seem to run a bit smaller than expected.
639,Amazon Customer,4.0,the United States ,"August 12, 2022",Bama Mama,Have purchased this item before
640,RASON THUBERI,4.0,the United States ,"July 27, 2022",nice,nice
641,Narie,4.0,the United States ,"June 17, 2022","They are worth the price, not a bad fit.",They are okay
642,Happy234,4.0,the United States ,"July 5, 2019",Inaccurate size chart,"I ordered my 5 year old a pack of the small and 2 packs of the medium based on the size chart provided by amazon. The small were way to small. The mediums were a much better fit. I attached the actual size chart from the back of the package. My son is big for his age(wears size 7/8) so I would have assumed the small would have fit, but they did not. The texture of the fabric is nice and easy to move in"
643,Ny,4.0,the United States ,"February 21, 2021",Honestly I would buy again.,"Like everyone has stated the sizing is definitely off. My 6 year old is a little bigger but he isn't supposed to fit in a 10-12(medium) lolWhen I first took them out, I thought they were going to be way too big for him but once he put them on, they actually fit great.He's a 7/8 in pants. Almost 70 pounds and tall"
644,Blackwiddah,4.0,the United States ,"July 18, 2020",Good Value,"Hanes makes great mens and boys underwear.  I have a son and a grandson who are both very tough on their drawers.  And I have always bought them Hanes.  They just last, wash after wash.  Especially the elastic, which is usually the first thing to go.  They are also tagless, ( my grandson hates tags )  and the new breathable mesh is great for the humid New England summers and fall.  They don't stretch out of shape either.  Highly recommend."
645,Lluvia Magras,4.0,the United States ,"April 25, 2020",Great Quality,"My son is 9 turning 10 in a few months weights 90 lbs. Normally he is a Medium. He was super happy when he put them on they were very comfortable , soft and definitely breathable. My only reason for. 4 stars is because I ordered what I thought were the colors in the post instead we got the other set of colors grey, bright green , black ect. We loved the colors but we should be getting exactly what we ordered or let us know before it ships. Overall  great quality 👍🏼"
646,Loves iPads,5.0,the United States ,"December 10, 2022",COMFORTABLE for picky kid,These are VERY comfortable for a kid who is picky about the comfort of underwear. RECOMMEND!
647,Lindaspy,5.0,the United States ,"December 1, 2022",No more crack problems :),Grandson loved them ..much better than briefs
648,latoya gordon,5.0,the United States ,"November 9, 2022",I am thankful everything works out wonderful,The where comfortable
649,Susie Jo,5.0,the United States ,"October 17, 2022",My son’s favorite!,My son loves these and says they’re the best undies ever. I bought two packs for him and got a variety of colors.
650,jessica huff,5.0,the United States ,"October 13, 2022",Best,"My son is on the spectrum, these are the ONLY underwear he will wear."
651,Tammy Schwendeman,5.0,the United States ,"October 17, 2022",Comfortable underwear,The comfort and the fit
652,BernPam,5.0,the United States ,"September 30, 2022",Very nice,I wear these almost every day. The cloth isn't super soft but then again I don't want a fur coat as my underwear. They stretch around my butt perfectly.
653,Marco Gonzalez,5.0,the United States ,"September 27, 2022",Happy 12-year-old son!,"My 12-year-old son was happy with these boxer briefs. He plays flag football, so he likes the ones that stretch. He told me, ""Thanks, Dad ...you picked the right ones."" Mission accomplished."
654,Paul Singh,5.0,the United States ,"September 28, 2022",Lovely underwear,Great fit and does not stretch at the legs when worn. Keeps a nice tight fit
655,Twal,5.0,the United States ,"August 17, 2022",Los mejores,"La marca y tela preferida de mis niños.  He probado  con otros modelos y solo quieren éstos.  Super cómodos y la tela deja respirar la piel, no se deforman  con los lavados ni con la secadora. Deberían  agregar más colores, ya que hace años que los compro y los colores en el pack son siempre los mismos."
656,Matt Baldwin,1.0,the United States ,"October 12, 2022",The sizing is listed wrong on here,Although listed as a size 5-7youth shoe size these socks are a child 10-3youth.
657,Amanda W.,1.0,the United States ,"May 21, 2022",Did not get the size I purchased,"I ordered the size advertised for 5Y to 7Y shoe size. The product delivered had that sticker on the outside, but the actual label was for a much smaller foot. I will keep them and give them to my granddaughter, but they definitely do not fit my size 5.5Y daughter's foot."
658,Chris Kaniecki,1.0,the United States ,"August 23, 2022",Wrong size listed,These would fit more like an XS-SM than a medium. Otherwise they’re good quality
659,Grayson,1.0,the United States ,"May 5, 2022",These are way to small,I ordered this same size before and they fit me perfect these are a toddler size and cannot physically fit into them any chance i can be refunded or sent a new pair
660,Amazon Customer,1.0,the United States ,"May 6, 2022","NOT size 5Y to 7Y, they are 2Y-4Y, a waste of time l.","No stretch because they a not sized correctly, do not waste your time these are x small suited for a toddler 2-4 NOT 5-7"
661,michael,1.0,the United States ,"June 8, 2022",Worst purchase ever,Sent they wrong size 4 times. I give up. Going to buy them from footlocker instead.
662,Jerry & Jaclyn,1.0,the United States ,"June 30, 2022",Small,Didn’t fit a 12 year old girl
663,Rylea,1.0,the United States ,"January 19, 2022",Received the wrong size twice.,"I ordered the youth 5Y-7Y and received a different size. Returned them and ordered again. And again, received the wrong size. Super annoying."
664,Jennifer,1.0,the United States ,"January 13, 2022",Not the size listed! These are NOT 5Y-7Y.,Will be returning. Listen to the other reviewers- these are NOT 5Y-7Y! They are 10C-3Y.
665,Family Shopper,1.0,the United States ,"October 20, 2020",Disappointing!,"On second wearing, a hole appeared in one of the socks.  Not up to Nike's previous standards!"
666,Rachel Brunson,2.0,the United States ,"November 30, 2022",Too small,These are fine. Thin & not 5Y to 7Y.
667,Steve,2.0,the United States ,"July 25, 2017",Run real small,We bought these for our son they are way small and even shrunk after we washed them.
668,Elva,3.0,the United States ,"November 9, 2022",These are not 5Y-7Y Big Kids sizes,These socks are for 5-7 YEAR OLDS LOL
669,Kristen,3.0,the United States ,"September 13, 2022",Not crew socks,Nice socks but not crew socks
670,⚡️🐆Evellyn 🐆⚡️,3.0,the United States ,"June 24, 2022",small,they run super small
671,Brook W,3.0,the United States ,"April 19, 2022",Sheer,Good socks but on the thin sode
672,FlyDiver,3.0,the United States ,"November 12, 2015","Size is smaller than other, similar, Nike socks.",Have order the same size before but this time the socks were slightly smaller.
673,Brandon B.,3.0,the United States ,"December 14, 2015",Three Stars,They are socks. They do their jobs well.
674,Amazon Customer,3.0,the United States ,"September 2, 2016",Three Stars,kinda small
675,Michelle Campbell Gilmartin,4.0,the United States ,"January 17, 2017",Good socks but might run big...,"These are very nice socks. I bought this same size last time and they fit my son fine.  This time however, a year later, he is up a shoe size, and they are too big on him!  He loves the socks so we are sticking with them but something to note."
676,Steve,4.0,the United States ,"February 10, 2019",You get what you pay for,"Good quality, good fit"
677,MissyMe,4.0,the United States ,"December 27, 2015",Nice socks,These are nice socks but not the exact socks that my son wanted so i had to return the.  He is kinda picky.
678,connie,4.0,the United States ,"January 3, 2017",Four Stars,they fit fine
679,danao,4.0,the United States ,"August 4, 2016",Four Stars,nike socks always work well
680,Amazon Customer,4.0,the United States ,"July 22, 2016",Four Stars,Soft and sturdy
681,Luis A. Rojas MacHado,4.0,the United States ,"August 6, 2015",Four Stars,As expected a good item for school and sports.....
682,A. Krauss,4.0,the United States ,"July 5, 2016",Four Stars,ok
683,No name,4.0,the United States ,"September 13, 2015",Four Stars,narrow in calf
684,Yelianny Soto,4.0,the United States ,"January 27, 2022",Nike which sucks,"Good quality, soft, long and shipped"
685,linda shultz,5.0,the United States ,"November 15, 2022",Fit was good,Like
686,Ana Ponce,5.0,the United States ,"March 23, 2022",They’re fine.,Normal socks nothing to complain about other then they don’t have much stretch and for very snug
687,Siggy,5.0,the United States ,"December 14, 2021",Highly recommend.,These socks keep me warm. I prefer these over compression socks!
688,Joe Perry,5.0,the United States ,"September 11, 2021","Socks, all growing young men need.",My son loves them.
689,Susan Richardson,5.0,the United States ,"November 16, 2013",Atlanta kids love these socks to wear with their uniforms.,"These are the socks of choice for private school Atlanta for both boys and girls (personally, I think these crew socks look a little dorky with their uniforms). I had trouble finding them small enough for my 13 year old daughter with skinny size 6 feet). These worked perfectly for her. She says they fit perfect and are comfy. They also wash up well."
690,Shannon Ollenberger,5.0,the United States ,"September 23, 2015",These are the best socks I have ever bought for my son,These are the best socks I have ever bought for my son. I thought they were a little expensive but now I truly understand you get what you pay for. They haven't stretched out. They are really nice socks
691,Tracy Sundberg,5.0,the United States ,"November 24, 2012","My son's favorite socks, now...","After he outgrew the colorful socks I used to put him in, he found these at an expensive department store. He loved them. I was very glad to see them for such a good value on Amazon. I will buy more in the future, I am sure!"
692,Ms Leo,5.0,the United States ,"November 14, 2014","cute socks made of a great quality, long lasting","cute socks made of a great quality, long lasting,  nice padded heels. Bit on the tight side but that's normal from my experience with Nike athletic socks if you buy these you will not be disappointed"
693,Carol L. Kwan,5.0,the United States ,"October 21, 2012",They work for women too,I'd been looking for women's cotton crew socks to wear with my hiking boots.  These are a cotton blend and they work great - not too bulky and very comfortable.
694,RJB,5.0,the United States ,"December 7, 2014",My son wears a size 7 boys shoe and these ...,My son wears a size 7 boys shoe and these fit perfectly. I wear a size 7 women's shoe and they fit me also.
695,suni,1.0,the United States ,"November 30, 2022",Thin rain coat,"THIN, rain coat."
696,Wim Verkaik,1.0,the United States ,"September 2, 2022",be aware - this is for a child,"Misleading order information. This came up when I searched for a MEN's rain jacket.  No clue in description, but small print says boy's jacketSo have to return and find something locally."
697,S R.,1.0,the United States ,"August 13, 2022",Thin and Cheap,"For my son, got it to serve as an outer layer windbreaker. Offers zero warmth, basically slightly more stylish, but not more effective, than a rain poncho from the dollar store."
698,J R,1.0,the United States ,"August 21, 2022",This is a youth jacket,I’m not sure why this jacket pops up when specifically searching “mens rain jacket.”
699,Thomas welker,1.0,the United States ,"August 8, 2022",not good,not good
700,Tiona,1.0,the United States ,"November 11, 2021",Way too thin.,"Not happy about this purchase. This jacket is waaaaaay too thin. Like paper thin. Even with a hoodie underneath, no warmth at all"
701,RJT,1.0,the United States ,"October 31, 2020",Thin Junk!!,This is super thin junk. They slap a Columbia logo on it and sell it for a premium. I sent it back because it was soooo bad.
702,09iiga,1.0,the United States ,"December 13, 2019",dont call it a jacket,"this is not a Jacket, its a rain poncho made to look like a jacket.  no lining, very thin plastic bag like material.  very disappointed with Columbia for calling this a Jacket."
703,Jenni,1.0,the United States ,"November 28, 2020",..,Not buying again
704,elizabeth99,1.0,the United States ,"April 12, 2016",Disappointed,This jacket doesn't feel like it is worth $30. It looks better in the photo. We'll see if it is water resistant at least. It runs small. Disappointed.
705,KCROB,2.0,the United States ,"August 28, 2022",Zipper fell off,"This was a nice lightweight rain jacket. My some wore it maybe 3or 4 times, more as a wind breaker than for rain.  Then the zipper fell off, and now it is useless because it can not zip."
706,Shannon Walker,2.0,the United States ,"May 17, 2022",Not good in cold rainy weather,I bought this for my son to wear during a day at outdoor school. He said it wasn’t warm and he got soaked by the heavy rain.  The material is very noisy.
707,Sarah,2.0,the United States ,"March 20, 2020",No lining.,"My son needed a thin raincoat b/c we live in Hawaii. It’s hot even when it’s raining, I just need him not to get wet. Also, he wouldn’t be wearing it for an extended period of time. I needed thin, not cheap. This coat has zero lining. Usually there’s at least a net like material lining inside thin raincoats. So if your kiddo doesn’t mind the feeling of a hefty bag directly on his/her skin, then this is the raincoat for him/her."
708,Amazon Customer,2.0,the United States ,"February 8, 2020",At first glance,"I thought it was a trash bag! Tried it on. It’s ok  fabric is horrible it won’t keep u warm it’s so thin, but It is water proof.  so not worth the 26$ And the reviews 👎🏼"
709,Maria,2.0,the United States ,"April 26, 2018",The product fit fine. The quality was poor,The product fit fine. The quality was poor.  I thought it was lined like most rain jackets. This jacket is more like a poncho. Real thin waterproof material. If my son didn’t need it for our trip I’d return it. Not worth the money I paid.
710,Nicole Ago,2.0,the United States ,"May 1, 2018",Thin and no liner,Its cheaper than any other Columbia items... not good quality
711,Patty,2.0,the United States ,"April 2, 2018",Two Stars,Much smaller than size stated.
712,Amazon Customer,2.0,the United States ,"August 14, 2016",Two Stars,"Was smaller than expected, and tight in the shoulder and elbow regions."
713,TPG873,3.0,the United States ,"September 24, 2022","Really thin for price, not netting or barrier","Got this for my 7 yr old (size large), hes 65lbs, 4 ft 1 and it's pretty big on him but doable. Got it to last 2 years anyway. The material is super, super thin, and there is no lining...not even a netting layer. Just windbreaker material on skin. For the price of $30, this is NOT worth it."
