,Name,Star,Location,Date,Title,Review
1206,Whit,5.0,the United States ,"December 5, 2022",Great Pants. Better Price.,"My son wears these as part of his school uniform, and he is ssssooooo tough on his pants. He rips the knees out of every pair he wears. He’s been wearing these almost 5 days a week since August and they are still going strong!!!"
1207,Julie,5.0,the United States ,"November 28, 2022",Sturdy Pants,These are nice sturdy pants. We use them for school uniform and they work perfectly. My boy is pretty rough on his clothes and shoes and these seem like they will really hold up.
1208,z h,5.0,the United States ,"November 27, 2022",My favorite pants,I've been ordering these dickies for a while and they always come fitting as expected and they don't shrink. You can definitely wear them in and they will still look new with ironing. Love!
1209,Al,5.0,the United States ,"November 21, 2022",Basic school pants,Bought them for my son for his school uniform. So far they have survived a couple weeks of wear and wash.
1210,Amazon Customer,5.0,the United States ,"November 30, 2022",Good fit!,Great fit!
1211,Kristy,5.0,the United States ,"October 21, 2022",Perfect for what he needed it for,Loved the inside tightening straps to make the waist smaller. Perfect fit once we tightened the straps in the waistline
1212,Lindsay,5.0,the United States ,"October 10, 2022",The price for value is great!,Dickies are so well made; my son & daughter wear this same style pant for skating & they last & look good for a long time.
1213,Kelly P,5.0,the United States ,"October 20, 2022",Great pants,Worked great for my son.
1214,Samantha Pratz,5.0,the United States ,"October 13, 2022",Strong,Good quality
1215,Madeleine Sanchez,1.0,the United States ,"December 3, 2022",Is not a Navy color.,I order Navy as show on the picture and instead a received a light blue. Also size 14-16 is too big
1216,Jannelle M Kidd,1.0,the United States ,"December 4, 2022",Only received 1 pair,"This is supposed to be a ""multipack"" but I only received 1 pair."
1217,jennifer,1.0,the United States ,"November 30, 2022",Received 1 pair not 2,I ordered the multi pack and only received 1 pair
1218,Amazon Customer,1.0,the United States ,"October 4, 2022",Not navy blue,"I ordered these for a school gym uniform, which needs to be navy not royal blue, but now we can't return them because they've already been worn. Please place more accurate pictures of colors."
1219,Amazon Customer,1.0,the United States ,"October 29, 2022",Dirty,These sweats came dirty! My son needed it as part of his costume.
1220,Alicia Szukalski,1.0,the United States ,"October 6, 2022",Not sized correctly,"Bad quality, size is not accurate way too short and I ordered the appropriate size"
1221,Catalina,1.0,the United States ,"October 5, 2022",The color is not blue navy so be careful. Couldn’t use it for my son school,The color is not blue navy. Be careful
1222,Mathhaias ,1.0,the United States ,"May 11, 2022",To small,It was to small and it said  true to size
1223,Mama16,1.0,the United States ,"October 30, 2021",Came ripped at the side seam,It was for a costume and we didn’t know it was ripped until putting it on for the Halloween parade so it wasn’t suitable to try to do a return. So we were stuck with these brand new ripped sweats.
1224,Ari Mack 5th Bday,1.0,the United States ,"April 10, 2022",Shrink & Fade,Looked good until first wash. 🤨
1225,Brittney,2.0,the United States ,"December 5, 2022",Comes with only one pair of pants despite the picture showing 2 pairs,Only came with one pair of pants despite the picture showing two pairs
1226,Eva,2.0,the United States ,"September 11, 2022",Not Navy blue!! ****be careful****,Be careful if you are looking for navy blue this is not it.. the sweater is navy blue but this pants are not. Unfortunately I had to send Mt kids with this pants but otherwise I would have returned it.
1227,D. C. Toran,2.0,the United States ,"October 15, 2022",Colors are off,Ordered Navy and it is not navy more like a royal blue
1228,Ged,2.0,the United States ,"April 23, 2021",White pants came with stains on them,"I ordered these pants for my 13 year old son, he needed white pants for a play that he is in.  He is slim and average height, the XXL 14-16 (which is his usual size) fit him really well,  with just a little room in the legs to grow.  The quality of the pants is good, the fabric is soft and good quality.  The reason I  only gave 2 stars is because the pants came with stains on them, right out of the plastic.  There is a green stain a few inches long near the waistband of the pants, almost looks like a grass stain.  On the back of the leg there is also a black line about 6"" long, looks like a pen mark.  I decided to keep the pants because neither of the stains would be visable on stage and I didn't want to deal with an exchange.  Even though the pants will work for intended use I am pretty disappointed that I received a product with multipe stains fresh out of the package."
1229,bndonaldson,2.0,the United States ,"November 1, 2021",Shrinks in a cold water wash.,These pants would have worked for our Halloween costume but after one cold wash they shrank about an 1 1/2-2inchs and faded horribly. I purchased the same size in light blue the year before and they are still the same size have a year of wear.
1230,The book mama,2.0,the United States ,"December 5, 2021",Pilly!!,These pants were purchased for Halloween costume - thank goodness! Because they can't be worn for anything else after a couple of washes! They've poked up so much that they look gray and disgusting!
1231,m170,2.0,the United States ,"November 25, 2021",Faded,They are nice sweatpants but don’t hold up. Have been worn 4 times & the color is completely faded out & they look terrible
1232,R. Baker,2.0,the United States ,"November 12, 2019",Fell apart before my kids even tried them on,"Before my kids even wore these pants, one of the waistband seams came apart during the initial washing/drying. My washer and dryer are so gentle that they’re barely effective at cleaning little boy clothes, so I don’t have much confidence in the quality of these sweatpants. The stitching is reinforced, so the waistband isn’t detaching yet. With that in mind, and given that this is my first issue with Amazon Basics clothing, I gave them one more star that I feel that they warrant. They’re not worth the hassle of returning though, so I recommend passing..."
1233,Elizabeth R.,2.0,the United States ,"March 7, 2021",Bleh - pretty bad,"These pants faded after just one wash. The draw string isn't adjustable. It's an odd fit (wide and big but shorter legs), but may suit other kids better. Not planning to buy another Amazon piece of clothing after this!"
1234,Jessica,2.0,the United States ,"March 27, 2021",Comfortable but not long lasting,These pants looked great initially and are a comfortable fit for my child. They have not held up to wearing and washing well though. They have faded in many areas. Won't be buying again.
1235,Celeste,3.0,the United States ,"December 4, 2022",good quality-came damaged.,"it has a hole in it.  I’m so disappointed. I took it out the package to try them on. I was so excited for these sweats.  My son didn’t even get a chance to wear them due to the hole on the side of his pants.  good quality, fit as expected just the hole smh."
1236,Karla Vzqz,3.0,the United States ,"December 2, 2022",Much brighter blue & runs smaller,"Much much brighter blue , wouldn’t pass uniform navy blue color like it looked on line. Size 14-16 more like a solid 14, didn’t work for mySon but still nice sweat pants for at home"
1237,Amazon Customer,3.0,the United States ,"December 14, 2022",Runs slightly big but otherwise great!,"Product was thick but eith goods trench, drawstring works great."
1238,M. Vogen,3.0,the United States ,"November 9, 2022",Good value but lots of shedding,This was perfect for my kiddo’s Halloween costume. Warm and true to size. I did notice lots of the internal fluff was shedding after his first wear so be aware of that but overall a good value.
1239,Meg,3.0,the United States ,"October 14, 2022",Only one set.,"I thought I was getting the 2 pack because the picture shows 2. But it's only one pair. Don't expect 2. Other than that they are really nice quality. Thick material and VERY soft. Just disappointed it was only one. Not sure why the black, and blue pants show 2 pairs in the picture. But just know that's not what you are getting."
1240,Kelli Besselman,3.0,the United States ,"October 17, 2022","Great pants, annoyed at price","These pants are great, good length/fit, and soft material.  However, they were a prime deal for the Amazon early prime days and were $2 more expensive than after the sale ended.  Hate when stores raise prices to have a sale.  Now that they're cheaper, they're definitely worth the money, just annoying 🙄"
1241,A Bronx Tale,3.0,the United States ,"November 12, 2022",Comfortable,A basic pair of Jogging pants for my grandson. Material a bit thin but comfortable.
1242,FriscoDad,3.0,the United States ,"November 14, 2022",Runs small,Xl is a kids size 10! Usually XL is 14/16
1243,Shauna,3.0,the United States ,"October 15, 2022","Fine for sweats, but the navy is NOT true to color","I ordered these for my son for his school uniform, unfortunately the “navy blue” is more of a royal blue and won’t really work"
1244,Giansan,3.0,the United States ,"October 1, 2022",Not navy,I needed navy and these are royal blue.
1245,Sydny Trejo,4.0,the United States ,"December 8, 2022",Fit great,Worked great for my sons marshmello costume! He said they are so comfy! Considering ordering more colors because my son loves these
1246,Lillian maher,4.0,the United States ,"November 23, 2022",Very comfy,Bought for my hubby he loves them they are soft and wash well ...not much shrinkage from. Dryer but still buttery soft
1247,Kelly stechmesser,4.0,the United States ,"October 31, 2022",Good price,Fits small
1248,D. Lewis,4.0,the United States ,"September 29, 2022",Good,It fit good. Nice fabric.
1249,MadBenjiMama,4.0,the United States ,"July 10, 2022",Sizes are not as expected,My son used these so much he wore them out eventually and of course being white they needed replacing. The white goes with almost all his shirts and it’s hard to find white.  So he had an XL and then I ordered an XXL which said it was a size up but they both ended up saying 10-12 so that was a bummer. He won’t be able to fit them as long but I can’t find anymore white ones so these will have to do.
1250,GypsyMama,4.0,the United States ,"September 10, 2021",Cute and comfy!,"I don't know why it is so hard to find pants that both look nice and are comfortable for kids- especially as they transition from one set of sizes to another (in this case, from toddler sizes to little boy sizes). My kiddos is short, but these weren't so long that they were a problem. They were slightly big when they arrived, but he grew into them very quickly and it was more because he was in between sizes than the garment itself. He loves how comfortable they are. I love the fashionable cut and the shark pattern that made them cuter than all of the athletic pants that you find places for them to play in. As it cools down, he is going to get even more wear out of these. Thanks, Amazon! With changing rooms closed at a lot of stores, I especially appreciate the free returns on items when we aren't sure what size the kids actually are wearing!"
1251,Denise,4.0,the United States ,"February 22, 2022",Nice product,These are well made and fit nicely. They wash well and I would purchase again.
1252,Kamilah Harris,4.0,the United States ,"November 15, 2021",Color is darker than pictured.,The pants are nice and fit well but they are more of a navy blue than a royal blue. Three off the outfit for my son but it was no big deal. They are nice quality and fit well.
1253,Karly C,4.0,the United States ,"November 30, 2021",Color didn't match,"The pants are fine, but I ordered the brighter blue for a costume and got the darker blue. Now I don't have time to get the right color."
1254,Annonymous,4.0,the United States ,"December 10, 2021",NO functional drawstring,"Very well madePants, thick enough for New England weather- but no drawstring so my 30 lb 3T toddler was swimming in it!"
1255,Edward Hanson,5.0,the United States ,"December 1, 2022",Exactly what I wanted,"I've nothing but good things to say about these. I bought these for my 6 year old son who has skin sensitive issues. Finding clothing that isn't ""itchy"" as he describes it can be frustrating at times for us. That being said these sweat pants fit true to size, are well made, are typical sweat pant thickness, are nice and soft and have no stitching on them that rubs against the skin. He's worn them a few times now and they have not shrunk while washing and drying. They are also fairly priced! I bought 3 additional pairs in different colors after we tested this pair and the quality has been consistent across every pair. I definitely recommend them."
1256,kttiekat,5.0,the United States ,"November 11, 2022","""ESSENTIAL"" joggers!","You can never have too many pairs of sweats when you have little boys and I have 3.  Being durable, comfortable and able to hold up to multiple kids is my standard on if a clothing item passes the test.  I have found so many Amazon essential clothing items that are my preferred brand over name brand, or department store brand, etc.  These joggers are made of a thick, but not heavy material with a bit of stretch that's perfect for an active kid.  They are easy to go up and down and actually stay around their waist which is a big problem with my kids who are twigs.  I need these in every color now!"
1257,linda durst,5.0,the United States ,"December 11, 2022",Best part is draw string,"We love them nice and thick ,flexible for my child to use for gym will be buying more."
1258,Danielle,5.0,the United States ,"December 9, 2022",Great pants,Great pants comfortable and they don't skrink in washer so buy the size that you actually need
1259,mayra,5.0,the United States ,"December 11, 2022",Buena compra,"El material está grueso, no se transparenta y muy cómodo"
1260,Kristy Crocker,5.0,the United States ,"December 3, 2022",Great for the price and great fit,I have twin 6 years. They have sensory issues. These worked great for them. They are about 50lbs. 44-46inches
1261,Renee S,5.0,the United States ,"December 13, 2022",Draw strings work,Good quality
1262,Megan Elizabeth,5.0,the United States ,"December 4, 2022",Great Quality!,The quality was great -- thick and cozy! The perfect sweatpants.
1263,Amazon Customer,5.0,the United States ,"December 10, 2022",Comfortable and warm,Great quality
1264,Brittney Klott,5.0,the United States ,"November 29, 2022",My sons favorite,My sons favorite pants. He only wants me to buy these. Very soft.
1265,Brittany,1.0,the United States ,"October 18, 2019",Different sizes,Bought a 3 pack and the shirts are completely different sizes. Very disappointed! Bought 4T ... 2 fit like a 3T and the other like a 5T
1266,Rawss,1.0,the United States ,"October 2, 2019",Shirts are different sizes,3 shirts bought in the same package and labeled as the same size. Each shirt is actually a significantly different size then the others. Not happy.
1267,Nancy D.,1.0,the United States ,"December 21, 2019",Mixed sizes,Very disappointed with order wanted size 4T got one 2T and two 4T don’t want the small one
1268,LENA,1.0,the United States ,"January 6, 2020",Poor quality,I need to stop buying just one you. Poor quality fabric and construction
1269,Rosally N. Bisbal,1.0,the United States ,"January 10, 2020",Late Delivery,Good product. Super long time to deliver item.
1270,Andrea Selak,1.0,the United States ,"May 19, 2019",Not correct size,I ordered 2T it’s huge more like a 4T
1271,Judith Precious,1.0,the United States ,"December 21, 2018",Poor Quaility,"Flimsy, not well made."
1272,Kyle,1.0,the United States ,"October 20, 2020",Stain on gray shirt,Unhappy that this set was stain when it was shipped to me. Needed one of the shirts for day of photo shoot so now can't return.
1273,rickybabe,2.0,the United States ,"October 11, 2020",Sizing is an issue here,"These t-shirts are really cute. Lovely colors. The quality seems good but they run big! Like really big! At first I ordered 4T for my almost 4 year old, had to exchange them for size 3T because they were huge! 3T was as huge as size 4T so I gave up and decided to return them. Too bad because they looked nice."
1274,NAS,2.0,the United States ,"March 16, 2019",Flaws in fabric,One shirt came with flaws in the weave right in the front of the shirt. The other two were fine but I noticed that they started to get little holes in the fabric after several washes. Not impressed and glad my son will grow out of them before they really fall apart. Won’t buy again.
1275,Mohamed S. Alhasan,2.0,the United States ,"January 11, 2021",Careful,"I have to change my review “Love it, my son 3 years old and I ordered 3t. It’s big”After we wash it it SHRINKS, very bad"
1276,christine,2.0,the United States ,"March 6, 2020",Light weight fabric,The fabric is lighter than I had hoped. I did see a review posted before 2 times aboy the fabric being to light weight just something for you to keep in mind when looking at buying this item for your child.
1277,Peter Tosch,2.0,the United States ,"October 23, 2019",Product is not thick at alll,Product is not thick at all. Does not appear to be much warmer than a regular long sleeve shirt.
1278,Felipe,2.0,the United States ,"November 4, 2019",Poca calidad,Muy sencillo
1279,Steven Lewis ,2.0,the United States ,"December 24, 2018",Not thick enough,Not thick enough for winter
1280,Pam Gómez Gatón,2.0,,"December 11, 2022",,"Me gusta mucho esta marca y mi hijo la ha usado desde que nació, pero últimamente la calidad deja mucho que desear. Esto es nuevo, viene como mal cosido, si esto lo cortas cada vez que lo laves se va descosiendo un poco más."
1281,Lizy ,2.0,Mexico ,"December 10, 2020",,"Yo esperaba tela polar, son térmicos, me decepcionaron un poco pero al final sin calientitos que era la intencion"
1282,James Bond,3.0,the United States ,"December 14, 2022",Good quality,"Just a bit too big, but otherwise it's pretty good."
1283,Jayden Torrijos,3.0,the United States ,"March 15, 2021",Bright colorful but a bit too big,"Bough it for my friend's son, it was too big and I selected the exact size she told me. So go down a size if they're inbetween sizes especially if skinny, if they have a belly, I'd say go up, bc it might not cover the belly."
1284,christine Sewell,3.0,the United States ,"December 29, 2019",You will be ironing!,Washed these before my son wore them and the neck wrinkles up pretty bad.
1285,Maria Ana Gonzalez Silva,3.0,the United States ,"July 15, 2019",good,"they are nice, the quality is good but not the best. For Less than 20ºC maybe not warm enough"
1286,David Whitis,3.0,the United States ,"December 12, 2019",Too thin,Too thin
1287,JB,3.0,the United States ,"October 23, 2019",Functional,Good but not great.
1288,Rufy,3.0,Italy ,"November 27, 2022",,"Un buon set di felpe ad un ottimo prezzo per i vostri bambini. Belli i colori e giusta la taglia. Non mi convincono del tutto,però, i materiali perché i capi sono poco confortevoli, non danno quel senso di morbidezza sulla pelle,per questo non mi sento di consigliarle del tutto."
1289,monica dhiman,3.0,Canada ,"January 30, 2022",,"I thought it will be thick and has fleece underneath but it is very thin, good for season before summer"
1290,Frank Niu,3.0,Canada ,"January 8, 2021",,Initially I really liked it because it feels comfortable and it’s 100% cotton. However I noticed my baby always scratches his neck when he wears them and yesterday it was all bloody and red. I switched to different shirts today and he’s no longer scratching. I’m wondering if the shirts caused this?!
1291,james,4.0,the United States ,"December 12, 2022",Shrinks after wash,"When I first got the shirts, they were very large. But after one wash, they fit my toddler perfectly and as expected."
1292,Julie H.,4.0,the United States ,"November 30, 2022",Quality good,Gift for grandson
1293,janegirl,4.0,the United States ,"March 10, 2022",They’re big!!!!,"My son wears 2T…but their 2T size is definitely in the 3T range. They’re big!!!! I hope they shrink a lot in the wash! Order a size down from what you would normally get! Very cute colors, though."
1294,LaToya W.,4.0,the United States ,"November 5, 2021",Good product,They are great for layering. No issues with the sizing. Plenty of stretch. Colors still good after washing.
1295,Reid Family,4.0,the United States ,"November 20, 2020",Nice long-sleeve thermals,"I'm usually pretty happy with Carter's products for my son and these long-sleeve thermal shirts are no exception. They are well made and comfy. Perfect for everyday wear during colder weather.  Nice mix of colors, too."
1296,Rebecca G,4.0,the United States ,"December 14, 2019",1 of 3 shrunk significantly after 1st wash,"I bought this for my son a bit early, he is wearing 12mo and I purchased 2T. I prewashed them before packing them into his ‘soon to wear’ clothes and the grey thermal shrunk significantly. The navy blue and yellow striped ones seemed to hold their size just fine, but the grey I pulled out because I think it shrunk to a 12 mo. It worked out fine for me because I bought them so early, but a warning to those who actually want all 3 the same size."
1297,Kelsey Harders,4.0,the United States ,"December 22, 2019",A little too large...,"I'm not a fan of toddler clothes with phrases and characters. I like to dress my son more ""grown up"" so these simple long sleeve shirts were a great find. I would recommend sizing down. I purchased the 2T and they did shrink a little when I washed them but they are still a little too large for my 2 year old who wears 2t clothing in all other brands."
1298,Keri Cammarano,4.0,the United States ,"June 5, 2021",Good purchase,Great purchase. Soft material!
1299,Heather T.,4.0,the United States ,"October 20, 2020",Seem to be a size bigger than ordered,"The shirts are longer than I expected. They fit more like a 3T than a 2T. However, they seem to be good quality."
1300,Amanda Groce,4.0,the United States ,"January 27, 2020",Nice,"These little thermals are great, but I thought they’d be thicker. Still, even with that said, I’d say it was worth the purchase. They’re very cute. My son is a 3T and I ordered a 3T. They are true to size."
1301,Sheri,5.0,the United States ,"December 10, 2022",Nice shirts!,"Good quality and material, and comfortable. My grandson likes them."
1302,Ohukno,5.0,the United States ,"November 29, 2022",Runs a bit big,Runs a bit big but very soft and cozy for my toddler om those colder days.
1303,Addie Phillips,5.0,the United States ,"December 6, 2022",great quality!,affordable and good quality!
1304,LK,5.0,the United States ,"November 14, 2022",Great thermal,"These are very nice shirts and they washed up great.  Really soft and love the colors.  Also, a good value!"
1305,dnkol,5.0,the United States ,"November 17, 2022",Nice and comfort,Good quality and nice looking. Accurate size
1306,Kristen,5.0,the United States ,"November 1, 2022",Comfy and good quality,"Comfy shirts and good quality. My son is in between sizes, so I sized up so they’ll last through the season. Nice colors that go with lots of clothing he has."
1307,Kasey,5.0,the United States ,"October 10, 2022",Great for cold weather,"Shirt are true to size, not too snug so they can be a layering piece with a onesie underneath, and a great thermal for cold weather.My son is 9 months, 22lbs, and 29” and the 12 month size was perfect"
1308,Vilma G Gonzalez,5.0,the United States ,"October 13, 2022",Ropa de niño de 18 meses,Le quedaron muy bien
1309,Hector,5.0,the United States ,"May 12, 2022",Awesome fabric and love the colors,this fabric is awesome!!! it's breathable yet keeps my son warm. the colors are great and I was waiting for these to be available in this size since my son outgrew the last set. Good quality overall
1310,Joanna Smith,5.0,the United States ,"October 15, 2020",Buy it!,"Great shirts for fall/winter time! I wish they had more colors! I could not find any neutral or girl shades like these ones for my kiddo and bought a boy’s set. Not a big deal, but it would be nice if they’d consider all the potential market.They fit a bit bigger than I expected (grey shirt the the Simple Joy thermal shirt in 2t), white/hearts shirt is a Target one in 3t, both washed. They shrunk on the first wash quite a bit, so don’t be shocked when you first see them.It’s a pretty soft shirt and has a bit of stretch to it. The end of the sleeves are tight on littles ones’ wrists and they’ll stay put when you put on a jacket or hoodie."
1311,Jeff,1.0,the United States ,"July 18, 2022",This for a fifth grader,Huuuuuugggeeeee
1312,Sonja Reynolds,1.0,the United States ,"February 26, 2022",Too big,Baught 3T and 4T they are huge!! My 6 yr old can wear the 4T.. ridiculous!!
1313,Anastasia Beaverhausen,1.0,the United States ,"March 7, 2020",Mildew smell,"They showed up stinking of mildew and I assumed improper storage, but also that a wash would fix it, no need to leave product feedback over something that insignificant. Washing didn't help, so I have nothing to do with them. They're trash. Booo."
1314,Courtney,1.0,the United States ,"September 30, 2021",I only received one pair of jeans when it's supposed to be two of them!,I only received the dark pair. There was supposed to be 2 pairs in the package
1315,Minimally.mckay,1.0,the United States ,"February 25, 2020","Cheaply made, over priced",Sent these back. Super thin material. Boxy. Low quality. Not worth the price.
