,Name,Star,Location,Date,Title,Review
0,M. Jones ,1.0,the United States ,"December 15, 2022",Not true to size,"These underwear run way too small, my son wears a 10/12 and they fit like a 7/8."
1,Daniela,1.0,the United States ,"November 8, 2022",Very small size,"Its size according to its age is deceitful, the description of the size is confusing; since I bought one for a 9 year old and it fits a 4 year old. It also has a stiff weave."
2,Madeline,1.0,the United States ,"September 1, 2022",Size was too small,description for sizes was confusing..  My son is small for his age and I ordered size S because I figured it would be slightly on the big side.  I got underwear that fit better on my 4 year old daughter.  My son is a very skinny and short 60lb boy and S is usually his size.  Wish I would have ordered a M or even a L.
3,Tee,1.0,the United States ,"September 28, 2022",No stretch/sizing off,I buy this brand often but first time from Amazon. They had no stretch or softness and I went according to size chart which is the size of all my son’s other boxers as well. I ordered L . Even outside the size they feel terrible on the skin
4,Kimberly Harris,1.0,the United States ,"November 19, 2022",Too small,Would have been perfect for someone else but was too small for my son
5,Shay,1.0,the United States ,"December 1, 2022",Boys underwear,They are soft and comfortable.
6,Sharon & Jen,1.0,the United States ,"May 9, 2022",SHRINKS HORRIBLY!,"Went ahead and ordered a size up since most of the reviews said they ran small...my son tried them on and said they seemed good, so I unpacked both packages purchased (20 pairs!!) and washed them in cool water and dried on low. THEY ALL SHRUNK! My son cannot wear them now and I cannot return them since I do not have them in the original packaging. I have never had a Hanes product shrink so badly! Seriously disappointed and now out $33...UGH!!"
7,Akram Hussain shaikh,1.0,the United States ,"August 27, 2022",Size is Fake,I order Large size but I receive size like a kid I cannot put my leg inside size is fake I wasted my money to buy this product in future I will not suggest any one to buy this product from Amazon otherwise you waste your money😔😔😔
8,Ada,1.0,the United States ,"November 4, 2022",Wrong size arrived,"Way too big. Says boys, came in men size"
9,MrsO837,1.0,the United States ,"July 12, 2022","Arrived stuffed into a bag, one *looks* new","Tried getting a refund on these boys underwear as they look used and ARE likely a return. They were stuffed into a clear bag and tossed into the box with the rest of my order *more underwear and socks as well. Tossing the Hanes knowing I won't get my money back. Better than another parent buying someone's discards, I guess."
10,S.M.S.,2.0,the United States ,"December 3, 2022",Size Chart Incorrect.  Runs very small. Size up!!,Bought mediums for my 8 year old based on the provided size chart and they are too small.  Unfortunately my husband had unpacked them so I can't return and I doubt he will be able to get them on. For reference both in picture are Hanes MEDIUM…gray ones are these. Way too small!
11,Janice Miller ,2.0,the United States ,"November 27, 2022",Size up,These fit small so be sure to size up at least one size.
12,leah camacho,2.0,the United States ,"July 5, 2022",Runs small,I was warned to buy larger. Fitting guidelines said my kid would fit the size medium according to his measurements. But for the weight he barely tipped into the large.  So I sided on the bigger size. He's too big for even the larger size up I purchased. He says they squeeze his booty too much. They look cheap too. Like all the seams will pop if they get tight.
13,Amber,2.0,the United States ,"November 18, 2021",Sizing is way off..  in my case anyways!,"My son wears a small/medium in boxers and pants. I usually get him a small in boxer briefs because they fit perfectly, but because I was ordering online.. I figured I'd go up a size, just in case. Well, they're still too small! The leg holes are very tight, and the waste doesn't have much stretch! So upset. The softness and style of them is exactly what I wanted for my son, but he is just too uncomfortable in them. I can't see returning underwear, because it's just weird.  So, I guess I'm stuck with 10 pairs of boxer briefs that don't fit. My son is 6 years old, wears a size 6-8 in clothing depending on brand. He is average weight, about 50inches in height, for reference. I can't imagine what they would be like after going through a dryer. Perhaps next time I will size up to a large,  or choose another style all together."
14,crynone,2.0,the United States ,"August 4, 2022",Don’t use sz chart,"My son is 11, long and lean. I originally ordered Medium size…waaay too small. Then I ordered Large…way too small…not sure if I will continue to order these. ¯\_(ツ)_/¯"
15,LOTOYA,2.0,the United States ,"August 13, 2022",Way to small,I’ve selected size 10-12 yrs … they can fit my 11months old nephew. Not for kids that are 8yr .
16,Jinx,2.0,the United States ,"September 9, 2022",First wear and the crotch were all seedy and rubbed out,They fit but the material isn’t great
17,Fiona G.,2.0,the United States ,"July 21, 2022",Too small,I’m trying to return these because one of the drawers were ripped and they were too small for my sons.
18,Marlen,2.0,the United States ,"August 27, 2022",Vienen más chicos del size que pides,La verdad no me gustaron
19,KHP,2.0,the United States ,"December 21, 2021",Too small.,"(Photo shows large black pair underneath and new x-large ones on top.)I ordered these for two growing boys ages 10 and 11 and I swear they were smaller than the ones I bought them to replace and it got worse after the first wash! Unfortunately, cannot recommend. Only giving two stars in case I made a mistake in size when ordering, but pretty sure I got either the large or extra large. (Update- I checked and I ordered the x-large!)"
20,Jagmichael,3.0,the United States ,"November 28, 2022",Snug,My son is 5 and weighs 45 pounds.  He’s 46 inches tall.  23 inch waist.  I ordered a small but they are very tight on his waist.  I would order a size up next time.
21,SMM,3.0,the United States ,"December 4, 2022",Only 8 in this 10 pack,"When I opened this package, I found only 8 pairs instead of the advertised 10. It wasn’t worth returning, but just be aware."
22,Amazon Customer,3.0,the United States ,"November 18, 2022",Small but cozy,Order a size or two up. I ordered 10/12 for my very tall/slender 6 yr old who regularly wears a size 8. They were still slightly tight but usable so we kept them.
23,Dan P.,3.0,the United States ,"November 15, 2022",These were too small.,They didn't stretch and were just too small.
24,Yaya,3.0,the United States ,"October 11, 2022",A bit small,"My son is a size 16.  They fit really snug, and he is on the skinny side.  Order a size up."
25,Robert Zafuto,3.0,the United States ,"September 17, 2022","If you want stretch, keep looking.","At least 4 pairs in this pack are unwearable because the patterned material used has ZERO stretch, they won't go above his knees. The plain color pairs are soft and comfortable. Very disappointed that we didn't discover this before he had already worn a few pair."
26,Sam O,3.0,the United States ,"June 22, 2022",These run small!,"These run small small small. My son wears an 8 in pants and shorts but I read the reviews that these run small, so instead of getting a medium (8-10), I got a large (12-14). I was really nervous doing so because 12 is usually a bit far from 8 but I trusted the reviews. They barely fit. I washed them in warm water and dried on low heat like I do with all my clothing. They fit just barely. I would return if I hadn’t already washed them, and I have a younger boy who can wear them. But I would size up twice next time if I was to purchase again."
27,ndnbooh,3.0,the United States ,"September 6, 2022",Way to small for a big boy.,I ended up purchasing men's size medium. These are too small. They're more like a boys size 14.
28,Tina,3.0,the United States ,"August 28, 2022","So disappointed, I ordered a pack of 10 boxers and only received 5 of them in the packet","I love them but I am disappointed with the amount in the packet, I ordered 10 and I only received 5 of them"
29,Lane Bogue,3.0,the United States ,"July 24, 2022",Way too small,"Runs at least one size small. The camo is laid on top of another Hanes medium brief. There’s a huge difference in size, and these camo ones were not even close to fitting. Legs are small, waist is small, and unfortunately I washed all of them before I noticed. Pick another style  because these are not consistent with all of the other Hanes briefs."
30,Kerin Liu,4.0,the United States ,"November 29, 2022",Too small,I bought XL but it is still too small for my son
31,adrian,4.0,the United States ,"November 23, 2022",great product,"great design, fits as it should"
32,MP,4.0,the United States ,"October 27, 2022",Decent Underwear,"The underwear are on the thinner side, the material is a bit rough and they appear a bit smaller than average, but overall a decent buy."
33,Sadekimberly,4.0,the United States ,"October 16, 2022",Please with my purchase.,Exactly as described by seller.
34,phyllis potts,4.0,the United States ,"October 17, 2022",Xmas gift,Xmas gift
35,Bander Ibrahim,4.0,the United States ,"September 30, 2022",Good value,They are soft and comfortable. They run a little small but not that much.. Happy with my order.
36,Catherine Car,4.0,the United States ,"October 12, 2022",Not my fave,Run small
37,Laura Johnson,4.0,the United States ,"August 29, 2022",Order 1 size up,"Super cute, soft, comfortable. My only recommendation is to order 1 size up as they run small. Great value and cute prints"
38,Crystal Payne,4.0,the United States ,"August 15, 2022",If you child likes his under wear tight order to size if they like a little big order up.,These boxers are stretchy to a point. My child wears a 10/12 and they are tight. As far a comfortable he loves them. They are also soft.  Would recommend just know how you child likes his boxers. If they like loose order up.
39,Amanda,4.0,the United States ,"June 13, 2022",Thought they might be too big….,"There is no size chart in the post for this product. I ordered medium expecting it to be 7/8 after reading the answered questions. It actually has 10/12 on the package. I thought I’d be returning these because they would be too big. I opened the ziplock package and took a pair out to size them up next to my son. They look like they would fit him fine, especially if they shrink just a bit. He wears a 7/8 in clothing. He is 9 years old 53.5 inches tall and 64lbs. Bottom line is that these seem to run small. Hope this helps!"
40,Cali,5.0,the United States ,"September 28, 2022",Our go-to value boxer briefs for my son,"Exactly as advertised. Every time my son goes up a size we reorder these boxer briefs for him in his new size. Underwear is very much a personal decision on what a person expects of them, but for my son, these are his go to.The sizing is consistent and accurate to the size chart and the value of how many you get in a pack is important for us when choosing underwear. My son has never once complained about this brand or lack of comfort. They do have elastic waist band and the legs are a basic stretchy cotton. I will say they appear to sometimes get baggy around the legs at the end of the day and don’t continually offer “compression” but again, my son has never complained, so it meets my expectations. I haven’t had an issue with shrinking or anything either. They do become faded over time and definitely don’t look new forever, but again, it’s boys underwear, who is going to see it?My son is tall and on the slimmer side and these work well. I usually by his pants in slim, but he isn’t a true “bean pole” type either. I’m not sure how these would fit on ultra skinny or heavier set boys but they are stretchy.Pros-Price per pairConsistentcomfortable (so I’ve been told)Cons-Maybe the elastic waist band for someColor fades after many washes."
41,Bobbie,5.0,the United States ,"December 5, 2022","Good fit, comfy for my son","Not a ton of stretch but it's there. My son says it's comfortable & he loves the patterns. He's a solid kid, normally a size 10 & we ordered the large size with it fitting perfect."
42,jenn kronenburg,5.0,the United States ,"December 8, 2022",Hanes boy's boxer briefs,"My nephew will only wear boxer briefs so when you fobs some that are comfy and sized well, you buy them. Good value."
43,Kindle Customer,5.0,the United States ,"November 30, 2022",My husband loves these,These were perfect for my husband. I especially like the quality of the fabric. Its strong and durable.
44,Connie J.,5.0,the United States ,"December 6, 2022",Strong and durable,Perfect for my needs but too expensive for what ya get
45,J.Russo,5.0,the United States ,"December 4, 2022",Hanes  boys briefs,Bought these for my grandson. Very good price.
46,Daniel,5.0,the United States ,"November 29, 2022",Fits small,75 lb 8 yr old wears size lg and is snug!
47,Subbaiah Maneyapanda,5.0,the United States ,"November 30, 2022",Soft,Super soft and perfect fit.
48,Amazon Customer,5.0,the United States ,"November 19, 2022",Soft and stretchy,Soft and stretchy. Perfect fit for the size the website recommended. Very reasonably priced. Will buy again.
49,Tawana Boyd,5.0,the United States ,"November 18, 2022",Comfortable,Great quality and comfortable
50,VVVik,1.0,the United States ,"September 15, 2022",Very disappointed,"My son currently is wearing Large in underwear. They are getting a little small but still fit him. I wanted some for him to transition into so I purchased the next size up, which were these in XL (14/16) They are so small we can't even get them up half past his calves!! I already washed them not thinking they wouldn't fit!! I'm out the money and stuck with underwear that wouldn't be tight on a toddler! Now he will have to wait a month till I get paid to buy some that fit! I won't be buying this brand or for this buyer!"
51,Whitney Kaufman,1.0,the United States ,"November 28, 2022",Arrived in a sloppy mess,Giving one start because the underwear had been opened. The package was torn and sloppy. Underwear had obviously been taken out and returned or something… not impressed
52,Maykel Coffre,1.0,the United States ,"November 12, 2022",No me es funcional,"Pensaba que el tamaño era grande comparando con ptras marcas y es peor; ni pude colocarmelo bien y preferi en regalarlo pero no vale la pena ni venderlo, es tamaño de niño"
53,Tellisto,1.0,the United States ,"October 17, 2022",Nice but too small,"The fabric seems nice but my biggest issue is my 4yr old could not fit the SMALL.  Small can fit my 18 month old.  I don’t know how they come up with weight and measurements.  If you are to buy this, you might need to go 2 sizes up."
54,Jenney,1.0,the United States ,"October 20, 2022",Open item. Returning.,I’m not so sure I didn’t a returned item.  The underwear was sent to us in a clear bag with no tags or Hanes packaging.  Just all the underwear wadded up in a clear bag. I don’t feel good about this.  I’m returning them.
55,Dillois,1.0,the United States ,"September 8, 2022",Ain't nobody got time for this,"We're a busy family - kids, school, everyday after-school activities, fam time. Buying things like the underwear we always buy online saves us time. Do yourselves a favor and don't waste any on these. 5 of 6 pairs were unraveled, a complete seam gone on the red pair (see pic). Are these even really Hanes?"
56,Cindy S.,1.0,the United States ,"September 5, 2022",Looked great but first wash destroyed them.,After the very first wash there were long threads everywhere that came out from the stitching along the leg holes. So the legs are unraveling to the raw cut edges already. Pretty disappointed.
57,Mari,1.0,the United States ,"October 4, 2022",Fell apart,One washing and the thread completely unraveled from the leg. They're nice feeling but just poor quality. I'm returning them.
58,Theresa,1.0,the United States ,"October 18, 2022",small Run,These underwear run really small. I wouldn't wasted your time.
59,M.E.,1.0,the United States ,"May 28, 2022",Terrible quality,"Unraveled during the first wash. Had to throw away 2 pairs immediately because they were so destroyed, even just on a normal cycle. Save your money."
60,Sarah Lanier Rose,2.0,the United States ,"October 29, 2022",Very poor quality,One wash and the stitching came completely undone on two of the pairs.  Won’t buy again.
61,Jfraser,2.0,the United States ,"June 17, 2022",Sent Returned Item,"While the underwear are as expected, the seller sent me and item that had been returned. The underwear were not in the original packaging and there were 5 pairs sent, not 6."
62,BeagleMom08,2.0,the United States ,"June 5, 2022","Not true to size, shrinks","The fabric on these seem okay, but they are not true to size (smaller) and they shrunk more after washed and dried…a waste"
63,Melc,2.0,the United States ,"February 22, 2022",Go up at least 2 sizes!! Way too small!,My 7 year old couldn’t fit in the mediums comfortably. I purposely ordered up a size to make sure they fit and was happy when I saw they were 10-12. There’s no way these are 10-12 maybe a size 8. :(
64,carol,2.0,the United States ,"July 24, 2022","Does not run true to size, very small",Runs small
65,NC,2.0,the United States ,"February 11, 2022",No give!,If you really want these order a size up. I bought these for my sons and talk about nut huggers. These undies have zero give…barely any stretch to them. Makes for an uncomfortable day at school.
66,Jamie Warren,2.0,the United States ,"June 26, 2022",Order one size larger,By a size up
67,LAWACO TOE,2.0,the United States ,"April 27, 2022",Run SMALL,Please order one size up to be safe
68,Cristina Mendoza,2.0,the United States ,"April 5, 2022",Run small,These boxers run small definitely recommend going a size up
69,Carly Whitaker,2.0,the United States ,"April 23, 2022",Too small,Too small for my son.
70,Susan P,3.0,the United States ,"September 16, 2022",Wish Quality Was Better,"Super soft and fits as expected for my 9 year old. But unfortunately, 2 of them already have a run in them. A little difficult to see on the blue ones. My son has worn these once after initial wash. Very disappointed with the quality. I always buy Hanes for my boys and this is the first time I've had any issues with their boxer briefs."
71,Rglowe,3.0,the United States ,"September 21, 2022",Would be great but,These would be great except they are way too small. My son wears a small but after reading the reviews I ordered up and for these in a medium. They are still too small! It’s like there isn’t enough length in them. They aren’t too tight but they barely cover his butt crack and look super uncomfortable.
72,Martinez32,3.0,the United States ,"October 23, 2022",Run small,Bought for my 9 year old they run a bit smaller than what I thought ended up returning them
73,S. Sandy,3.0,the United States ,"September 5, 2022",Great until they snag,"The kid likes these. They fit well, the fabric is soft, and they seem to come up a little higher in back, preventing occasional plumber's crack.  However, they've been washed three times and worn twice and already have runs, snags, and holes. I've never had such delicate underwear. I washed on cold, in a front loader. To keep these nice might require hand washing, which is not really something I want to do with boys underwear."
74,Cleo S,3.0,the United States ,"October 19, 2022",After one wash..,The seams came off after one quick wash like the picture. very disappointed.
75,Yolayne,3.0,the United States ,"October 14, 2022",Pequeño,Pequeño
76,LM,3.0,the United States ,"September 18, 2022",Prefer cotton and need to be a little longer,Too short and I thought the material would have been cotton. My thinks it uncomfortable.
77,fostermom2008,3.0,the United States ,"June 14, 2022",Small fit,"Fit was small, tight, fabric does not stretch.  Son is in good shape & other brands fit him in his size."
78,Phyllis Conrad,3.0,the United States ,"May 23, 2022",They shrink up after wash.  Wish I would have gotten ex-larges,Looked the right size until washed.  Shrank up quite a bit.  Buy 1 size bigger
79,Laura Pomerleau,3.0,the United States ,"January 10, 2022",Order a size up,"Overall these underware are fine as far a quaility. My 13 y.o. says they are soft, but way too tight.  He wears a 14 slim pant, and normal cotton boxer breifs in Lg fit perfectly.  I'm reordering in XL.  I reccomend ordering a size up on these."
80,The Wymans,4.0,the United States ,"August 31, 2022",Too small with Minimal stretching,"Super cute and we were hopeful for a good fit. Sadly for my 10yo the XL was too small. The XL is a size 18-20 I believe which in my mind should fit pretty well. They fit him on the smaller side with minimal stretch. Cooper just turned 10 in August but is 105 lbs and 5’11 and has a good size bum. (Btw Dad is 6’4 so I’m assuming Cooper isn’t done growing) I figured if I added his size that would be helpful. I think if your child was smaller, these would be a great pair of underroos!  Btw-We ended up buying another brand as well 1 pack of  “5MAYI” Mens Small. (Also available on Amazon) They fit and feel amazing he said. I agreed seeing them on him. Just thought I would include the positive too about a good fitting pair for a larger/taller child."
81,Amazon Customer,4.0,the United States ,"October 16, 2022",Came in 2 different sizes,Super weird but I bought the 6 pack of XL for my son and I ended up with 3 pairs of XL and 3 pairs of L in the same pack…
82,laurenkalmond,4.0,the United States ,"October 5, 2022",Package was opened,"Moisture wicking material was nice and seemed well made but package had clearly been opened.  Out XL for my 5'8"" super thin, 13yo son"
83,Gail Burner,4.0,the United States ,"September 29, 2022",Not true to size,Grandson says their uncomfortable
84,Alan See,4.0,the United States ,"August 18, 2022",Very soft but shrank after washing in cold water.,Very soft but shrank after washing in cold water
85,Solangel Urena,4.0,the United States ,"August 4, 2022",Salen pequeños,Buena tela
86,Beth A.,4.0,the United States ,"July 4, 2022",A little small,He could wear them but they were a little snug around the legs for a 10 year old xl. He weighs about 100 lbs.
87,Jason S.,4.0,the United States ,"July 14, 2022",They run a little small,These run a little small
88,Ina,4.0,the United States ,"March 17, 2022",not the best for thin kids,ordered my almost 9 year old the large and he was swimming in them. then ordered the medium and they are still too big. He is a thin kid and these look like they should be for more stocky kids. we kept the medium and he will grow into them.
89,Kristi Wagner,4.0,the United States ,"February 18, 2022",Nice Undies but Size Up,"Soft, silky, and the band is secure. But size up. My seven year old normally wears an 8 and I got the medium. His thighs and crotch were being suffocated by these guys! I ordered a large and he seems to be happier."
90,Amber,5.0,the United States ,"December 8, 2022",Comfy,I love how they fit my 3 year old. Stretchy enough for movement and growth. Colors stay bright and washes well. This is his 2nd pack.
91,Angie N.,5.0,the United States ,"November 29, 2022",Picky son loves them,My son is super picky about underwear now and they can be SO expensive. These are a great value for the money and he says they are really comfortable. I like that they wash well - are quality
92,Renee,5.0,the United States ,"December 14, 2022","Great fit, stretchy","My son loves them. Fit great, no ride-up."
93,Smtswise,5.0,the United States ,"December 7, 2022",Fits Well,My 10 year old son wears a size 14 pants and this underwear fit him well.
94,Stephanie,5.0,the United States ,"October 27, 2022",6 year old is obsessed!,My son loves exercise shorts/tops material so thought we would try these when he needed new undies. He’s obsessed and refuses to wear cotton now (eye roll). So here I am writing a review and buying another pack! He wears a size 5 bottom and fits well in the small.
95,CupcakeBece,5.0,the United States ,"November 10, 2022",Great value,This variety pack is a great value for my growing 8 year old. The size fit as expected.
96,Marie Tirona,5.0,the United States ,"November 18, 2022",As described,"True to size, soft, colors don’t fade"
97,Michelle Iruegas,5.0,the United States ,"November 14, 2022",as described,my son loves them. very comfortable for him
98,Yuna0103,5.0,the United States ,"October 28, 2022",Perfect Fit,I thought these were gonna be a little big on my son because he's a little on the short side.  But they were a perfect fit and he loves them.
99,ARC,5.0,the United States ,"September 6, 2022",These will always be my go-to for my little guys!,"We've now purchased several packs of these for our boys from sizes small to large (and about to order XL). We've never had a single problem with even 1 pair and they've gone from my oldest son, to my youngest, and now to another kid. Normally, I'd think that's absolutely gross... but these have never stained, wash and dry extremely well (our washing and drying routine should be brutal on clothes--lots of high heat in both). I wash all of our clothes with peroxide poured into the bleach slot. These all look brand new always. Very very very pleased and my sons love them! They're the only ones we've used that just fit right with no worries. Good coverage, but good stretch--never tight. Zero complaints from this Mama of 2 boys!"
100,Amanda Becerra,1.0,the United States ,"November 20, 2022",They tore after first wash,I washed them one time with detergent no bleach and they tore. Multiple pairs all did the same thing
